{
  "$schema": "https://json-schema.org/draft/2020-12/schema",
  "$id": "https://koalapet.invalid/schemas/0.1/dungeon.schema.json",
  "title": "Dungeon 0.1",
  "type": "object",
  "required": ["id", "display_name_key", "encounter_ids", "boss_encounter_id", "reward_item_ids", "unlock_ids"],
  "properties": {"$schema": {"type": "string"}, "id": {"$ref": "#/$defs/id"}, "display_name_key": {"type": "string"}, "description_key": {"type": "string"}, "prerequisite_gate_id": {"$ref": "#/$defs/id"}, "background_asset": {"type": "string"}, "node_icons": {"type": "object", "additionalProperties": {"type": "string"}}, "encounter_ids": {"type": "array", "minItems": 1, "items": {"$ref": "#/$defs/id"}}, "boss_encounter_id": {"$ref": "#/$defs/id"}, "nodes": {"type": "array", "minItems": 1, "items": {"type": "object", "required": ["id", "kind"], "properties": {"id": {"$ref": "#/$defs/id"}, "kind": {"enum": ["encounter", "event", "rest", "hazard", "boss"]}, "encounter_id": {"$ref": "#/$defs/id"}, "heal_percent": {"type": "integer", "minimum": 0, "maximum": 100}, "damage_percent": {"type": "integer", "minimum": 0, "maximum": 100}, "choices": {"type": "array", "items": {"type": "object", "required": ["id", "display_name_key", "effect"], "properties": {"id": {"type": "string"}, "display_name_key": {"type": "string"}, "effect": {"type": "object", "additionalProperties": {"type": "integer"}}}, "additionalProperties": false}}}, "additionalProperties": false}}, "reward_item_ids": {"type": "array", "items": {"$ref": "#/$defs/id"}}, "repeat_reward_item_ids": {"type": "array", "items": {"$ref": "#/$defs/id"}}, "unlock_ids": {"type": "array", "items": {"$ref": "#/$defs/id"}}, "boss_flag_id": {"$ref": "#/$defs/id"}, "completion_experience": {"type": "integer", "minimum": 0}},
  "$defs": {"id": {"type": "string", "pattern": "^[a-z][a-z0-9_.-]*:[a-z][a-z0-9_.-]*$"}},
  "additionalProperties": false
}
